subreddit,category,title,score,num_comments,id,url
politics,top,Megathread: Joe Biden Projected to Defeat President Donald Trump and Win the 2020 US Presidential Election,214313,80928,jptq5n,https://www.reddit.com/r/politics/comments/jptq5n/megathread_joe_biden_projected_to_defeat/
politics,top,Mitch McConnell Will Lose Control Of The Senate As Democrats Have Swept The Georgia Runoffs,156756,10099,krntg6,https://www.buzzfeednews.com/article/paulmcleod/republicans-lose-senate-georgia-mcconnell
politics,top,Megathread: House Votes to Impeach President Donald J. Trump,147733,50628,ecm1zg,https://www.reddit.com/r/politics/comments/ecm1zg/megathread_house_votes_to_impeach_president/
politics,top,Trump Threatens to ‘Leave the Country’ if He Loses to Biden,135302,16093,jcm5dz,https://www.thedailybeast.com/trump-threatens-to-leave-the-country-if-he-loses-to-biden
politics,top,"Demands for Kushner to Resign Over 'Staggering' Level of 'Depravity' That Put Politics Before Public Health. ""Holy hell. Jared Kushner reportedly abandoned a national testing plan because it was *politically advantageous* to sit back and let blue states be eviscerated by the virus.""",129739,6746,i19sjg,https://www.commondreams.org/news/2020/07/31/demands-kushner-resign-over-staggering-level-depravity-put-politics-public-health
politics,top,Over A million people sign petition calling for KKK to be declared a terrorist group,129213,5678,h7ic8s,https://www.newsweek.com/kkk-petition-terrorist-group-million-1510419
politics,top,Report: Biden Admin Discovers Trump Had Zero Plans For COVID Vaccine Distribution,127951,8107,l1ynt4,https://talkingpointsmemo.com/news/report-biden-admin-discovers-trump-had-zero-plans-for-covid-vaccine-distribution
politics,top,Biden's Pennsylvania lead is now big enough to avoid an automatic recount,125947,5546,jsi48r,https://theweek.com/speedreads/949468/bidens-pennsylvania-lead-now-big-enough-avoid-automatic-recount
politics,top,"Donald Trump Has Just Left the White House—This Time, for Good",125231,5692,l1902k,https://www.thedailybeast.com/donald-trump-has-just-left-the-white-house-for-good
politics,top,Virginia governor makes Election Day a holiday and expands early voting,124071,4065,g03uny,https://www.cnn.com/2020/04/12/politics/virginia-election-day-holiday-early-voting/index.html
politics,top,"'Cry Me a River': Sanders Hits Back as Billionaire Investor Whines About Potential Tax Hikes Amid GameStop Fiasco | ""Oh look, another billionaire is mad that he might have to pay more taxes while children in America go hungry and veterans sleep on the street.""",123587,3174,l7ps56,https://www.commondreams.org/news/2021/01/29/cry-me-river-sanders-hits-back-billionaire-investor-whines-about-potential-tax-hikes
politics,top,"House charges Donald Trump with impeachment for ""inciting an insurrection""",123473,5989,kv4286,https://www.newsweek.com/house-charges-donald-trump-impeachment-inciting-insurrection-1560485?piano_t=1
politics,top,Giuliani sued for $1.3 billion by Dominion Voting systems over false election fraud claims,121168,4570,l4n1ho,https://www.independent.co.uk/news/world/americas/us-politics/giuliani-sued-election-fraud-trump-b1792216.html
politics,top,Pentagon cancels all contracts to build Trump’s border wall,120864,5756,n23k5m,https://www.independent.co.uk/news/world/americas/us-politics/pentagon-cancels-trump-border-wall-b1840500.html
politics,top,Sen. Elizabeth Warren wants to bar members of Congress from ever trading individual stocks again,120596,4589,nk564e,https://www.businessinsider.com/elizabeth-warren-ban-congress-trading-stocks-investing-tom-malinowski-nhofe-2021-5
politics,top,"FBI Asks for Evidence of Individuals Inciting Violence During Protests, People Respond With Videos of Police Violence",120344,2805,gvc4tw,https://www.newsweek.com/fbi-asks-evidence-individuals-inciting-violence-during-protests-people-respond-videos-police-1508165
politics,top,Joe Biden Has Taken The Lead In The Historically Red State Of Georgia,119503,10892,jp257j,https://www.buzzfeednews.com/amphtml/emmanuelfelton/biden-lead-georgia-vote-count#click=https://t.co/VsB6rFlwdr
politics,top,Mitt Romney says Americans who support Putin are ‘almost treasonous’,119396,5986,t2suj2,https://www.independent.co.uk/news/world/americas/us-politics/mitt-romney-ukraine-treason-tucker-carlson-b2024408.html
politics,top,Fox News sued for $1.6bn over false election claims,117423,5858,mdm92z,https://www.independent.co.uk/independent/news/world/americas/us-politics/fox-news-sued-lawsuit-election-trump-b1822880.html
politics,top,Megathread: House Votes to Impeach President Donald J. Trump for Incitement of Insurrection,116245,31277,kwqdsf,https://www.reddit.com/r/politics/comments/kwqdsf/megathread_house_votes_to_impeach_president/
PoliticalDiscussion,top,"In a recent Tweet, the President of the United States explicitly targeted a company because it acted against his family's business interests. Does this represent a conflict of interest? If so, will President Trump pay any political price?",23108,2484,5su9ig,https://www.reddit.com/r/PoliticalDiscussion/comments/5su9ig/in_a_recent_tweet_the_president_of_the_united/
PoliticalDiscussion,top,President Donald Trump has fired FBI Director James Comey,15065,2827,6a8jl9,https://www.reddit.com/r/PoliticalDiscussion/comments/6a8jl9/president_donald_trump_has_fired_fbi_director/
PoliticalDiscussion,top,"Michael Flynn has reportedly resigned from his position as Trump's National Security Advisor due to controversy over his communication with the Russian ambassador. How does this affect the Trump administration, and where should they go from here?",9918,2074,5txzyf,https://www.reddit.com/r/PoliticalDiscussion/comments/5txzyf/michael_flynn_has_reportedly_resigned_from_his/
PoliticalDiscussion,top,"Clinton has won the popular vote, while Trump has won the Electoral College. This is the 5th time this has happened. Is it time for a new voting system?",9864,3847,5c0pqa,https://www.reddit.com/r/PoliticalDiscussion/comments/5c0pqa/clinton_has_won_the_popular_vote_while_trump_has/
PoliticalDiscussion,top,The CBO just released their report about the costs of the American Health Care Act indicating that 14 million people will lose coverage by 2018,7685,1910,5z7h4b,https://www.reddit.com/r/PoliticalDiscussion/comments/5z7h4b/the_cbo_just_released_their_report_about_the/
PoliticalDiscussion,top,Megathread: President Trump has been Acquitted by the Senate on both Articles of Impeachment and will not be removed from office,7000,2912,ezgw2p,https://www.reddit.com/r/PoliticalDiscussion/comments/ezgw2p/megathread_president_trump_has_been_acquitted_by/
PoliticalDiscussion,top,"Intel presented, stating that Russia has ""compromising information"" on Trump.",6878,2920,5n8tv6,https://www.reddit.com/r/PoliticalDiscussion/comments/5n8tv6/intel_presented_stating_that_russia_has/
PoliticalDiscussion,top,Trump fires only Justice Dept. Official authorized to sign FISA warrants,6833,1143,5r5o9g,https://www.reddit.com/r/PoliticalDiscussion/comments/5r5o9g/trump_fires_only_justice_dept_official_authorized/
PoliticalDiscussion,top,Ted Cruz is dropping out of presidential race,6284,2554,4hrwn5,https://www.reddit.com/r/PoliticalDiscussion/comments/4hrwn5/ted_cruz_is_dropping_out_of_presidential_race/
PoliticalDiscussion,top,[Megathread] Iran Fires Missiles at U.S. Bases in Iraq Following US Strike Killing IRGC Major General Suleimani,5786,3369,elkxvb,https://www.reddit.com/r/PoliticalDiscussion/comments/elkxvb/megathread_iran_fires_missiles_at_us_bases_in/
PoliticalDiscussion,top,[Megathread] White House declares impeachment inquiry unconstitutional,5291,1591,df98y3,https://www.reddit.com/r/PoliticalDiscussion/comments/df98y3/megathread_white_house_declares_impeachment/
PoliticalDiscussion,top,CIA assessment says Russia was trying to help Trump win White House,5001,2526,5hhn4t,https://www.reddit.com/r/PoliticalDiscussion/comments/5hhn4t/cia_assessment_says_russia_was_trying_to_help/
PoliticalDiscussion,top,"[MEGATHREAD] Unclassified whistle-blower report alleging U.S. President sought foreign election interference, & subsequent White House cover-up, is made public; acting director of nat'l intelligence testifies before Congress; & more.",4473,1488,d9ldtg,https://www.reddit.com/r/PoliticalDiscussion/comments/d9ldtg/megathread_unclassified_whistleblower_report/
PoliticalDiscussion,top,Joe Biden wins 2020 U.S. Presidential Election,4308,5705,jptxfm,https://www.reddit.com/r/PoliticalDiscussion/comments/jptxfm/joe_biden_wins_2020_us_presidential_election/
PoliticalDiscussion,top,[MEGATHREAD] House Democrats launch impeachment inquiry of President Trump,4087,1855,d8uaqg,https://www.reddit.com/r/PoliticalDiscussion/comments/d8uaqg/megathread_house_democrats_launch_impeachment/
PoliticalDiscussion,top,"[Megathread] Trump requests aid from China in investigating Biden, threatens trade retaliation.",3783,923,dcx7bb,https://www.reddit.com/r/PoliticalDiscussion/comments/dcx7bb/megathread_trump_requests_aid_from_china_in/
PoliticalDiscussion,top,The Washington Post reports that Trump revealed highly classified information to the Russian foreign minster last week. How will this effect U.S. intelligence operations and intelligence sharing operations?,3763,1039,6bdlge,https://www.reddit.com/r/PoliticalDiscussion/comments/6bdlge/the_washington_post_reports_that_trump_revealed/
PoliticalDiscussion,top,"Why do the largest third parties in the USA, in the Greens and Libertarians, focus so hard on the Presidency instead of ground-level lower level offices to build themselves?",3452,549,4wg27n,https://www.reddit.com/r/PoliticalDiscussion/comments/4wg27n/why_do_the_largest_third_parties_in_the_usa_in/
PoliticalDiscussion,top,VFW (Veterans of Foreign Wars) has officially condemned the Trump campaign over the Khan comments,3355,924,4vnyrq,https://www.reddit.com/r/PoliticalDiscussion/comments/4vnyrq/vfw_veterans_of_foreign_wars_has_officially/
PoliticalDiscussion,top,Elizabeth Warren has been quietly removed from the Keynote Speaker slot at the DNC,3138,1104,4t77xf,https://www.reddit.com/r/PoliticalDiscussion/comments/4t77xf/elizabeth_warren_has_been_quietly_removed_from/
worldnews,top,An anti-gay Hungarian politician has resigned after being caught by police fleeing a 25-man orgy through a window,204543,8370,k4qide,https://www.businessinsider.com/hungarian-mep-resigns-breaking-covid-rules-gay-orgy-brussels-2020-12
worldnews,top,Trump Impeached for Abuse of Power,202897,19951,eclwg9,https://www.nytimes.com/interactive/2019/12/18/us/politics/trump-impeachment-vote.html
worldnews,top,Vladimir Putin's black belt revoked by international taekwondo organization,200161,6865,t3pgaz,https://www.newsweek.com/vladimir-putins-black-belt-revoked-international-taekwondo-organization-1683304
worldnews,top,"Two weeks before his inauguration, Donald J. Trump was shown highly classified intelligence indicating that President Vladimir V. Putin of Russia had personally ordered complex cyberattacks to sway the 2016 American election",189356,17967,901p5f,https://www.nytimes.com/2018/07/18/world/europe/trump-intelligence-russian-election-meddling-.html?hp&action=click&pgtype=Homepage&clickSource=story-heading&module=a-lede-package-region&region=top-news&WT.nav=top-news
worldnews,top,"Queen Elizabeth II has died, Buckingham Palace announces",189021,16349,x96k3v,https://www.bbc.co.uk/news/uk-61585886
worldnews,top,More than 150 senior Russian officials sign open letter condemning Putin's invasion of Ukraine as 'an unprecedented atrocity' and warn of 'catastrophic consequences' while urging citizens 'not to participate',178007,7644,t0b6fb,https://www.dailymail.co.uk/news/article-10546799/More-150-senior-Russian-officials-sign-open-letter-condemning-Putins-invasion-Ukraine.html?ito=rss-flipboard
worldnews,top,"Rejecting US evacuation offer, Zelensky says I need anti-tank ammo, 'not a ride'",171626,8188,t1o8wq,https://www.timesofisrael.com/liveblog-february-25-2022/
worldnews,top,Anonymous leaks database of the Russian Ministry of Defence,165229,6327,t1f287,https://cybernews.com/news/anonymous-leaks-database-of-the-russian-ministry-of-defence/
worldnews,top,"2.6 terabyte leak of Panamanian shell company data reveals ""how a global industry led by major banks, legal firms, and asset management companies secretly manages the estates of politicians, Fifa officials, fraudsters and drug smugglers, celebrities and professional athletes.""",154765,11956,4d75i7,http://panamapapers.sueddeutsche.de/articles/56febff0a1bb8d3c3495adf4/
worldnews,top,"Kyiv: full consensus for disconnecting Russia from SWIFT has been achieved, the process has begun",152113,6763,t20u4i,https://www.uawire.org/kyiv-full-consensus-for-disconnecting-russia-from-swift-has-been-achieved-the-process-has-begun
worldnews,top,Ukraine President Volodymyr Zelensky survives three assassination attempts in the last week.,151242,6283,t67pbu,https://nypost.com/2022/03/03/ukraine-president-zelensky-survived-three-assassination-attempts/
worldnews,top,Brazilian president Jair Bolsonaro tests positive for coronavirus,150315,7143,hmwhd7,https://www.theguardian.com/world/2020/jul/07/jair-bolsonaro-coronavirus-positive-test-brazil-president
worldnews,top,"Churchill's grandson slams Trump for skipping cemetery visit because of weather: ""They died with their face to the foe and that pathetic inadequate @realDonaldTrump couldn’t even defy the weather to pay his respects to The Fallen,"" Soames tweeted",150308,7921,9vw2w3,https://thehill.com/homenews/administration/416058-churchills-grandson-rips-trump-for-skipping-cemetery-visit-because-of
worldnews,top,B-52 US bombers fly over Middle East; Iran condemns intimidation. Iranian foreign minister says the US would be better off spending its military billions ‘on your taxpayers’ health’.,148050,8038,kzx08x,https://www.aljazeera.com/news/2021/1/18/b-52-us-bombers-fly-over-middle-east-iran-condemns-intimidation
worldnews,top,"Scottish Parliament votes for immediate suspension of tear gas, rubber bullet and riot shield exports to US",146830,3879,h0y6pm,https://www.independent.co.uk/news/uk/politics/scotland-us-exports-tear-gas-rubber-bullets-riot-shields-blm-protests-a9560586.html
worldnews,top,More than a quarter of a million people have signed a petition calling for Sydney's New Year's Eve fireworks to be cancelled and the money spent on fighting fires that threaten the city.,146433,3005,egvrh7,https://www.bbc.com/news/world-australia-50934149
worldnews,top,"Internet Defenders Urge Mass Revolt to Fight FCC's ""Scorched-Earth"" Attack on Net Neutrality: ""FCC Pai is handing over the internet to a few humongous gatekeepers who see the rest of us as products to be delivered to advertisers, not as citizens needing communications that serve democracy's needs.'",145860,3994,7erver,https://www.commondreams.org/news/2017/11/21/internet-defenders-urge-mass-revolt-fight-fccs-scorched-earth-attack-net-neutrality
worldnews,top,Uighur group calls for China to lose 2022 Games over 'genocide',144895,4921,i0ufzr,https://www.france24.com/en/20200730-uighur-group-calls-for-china-to-lose-2022-games-over-genocide-1
worldnews,top,"A conservation group has closed a $15.65 million deal to buy the largest privately owned giant sequoia grove left on Earth, an ancient forest with hundreds of the endangered redwood trees, which can live for 3,000 years and rise nearly as tall as the Statue of Liberty.",142951,2418,fbvzuo,https://www.mnn.com/earth-matters/wilderness-resources/blogs/alder-creek-giant-sequoia-grove-save-redwoods-league
worldnews,top,Giraffes just silently went to the list of endangered animals facing extinction,142121,3488,a79z9p,https://www.indiatoday.in/education-today/gk-current-affairs/story/giraffes-now-endangered-species-and-threatened-animal-can-become-extinct-html-1407091-2018-12-11
